id;species;category;light;difficulty;humidity;temperature;toxicity;cycle;waterSummer;waterWinter;fertilizeFreq;repotFreq;sowingMonths;plantingMonths;harvestMonths;floweringMonths;repottingMonths;pruningMonths;winteringMonths;soilInfo;pruningInfo;careInfo;generalInfo;esthetic;foliage;height;vegType;source_url
1; Monstera Deliciosa;indoor;partial;easy;medium;frostTender;low;perennial;7;15;30;24;;;;;[3, 4, 5];[3];[11, 12, 1, 2];Terreau riche et drainant;Couper les feuilles jaunies/sèches.;Pratiquez un arrosage régulier mais modéré.;Le Monstera est une plante tropicale grimpante, très appréciée pour son feuillage décoratif perforé et sa croissance rapide.;foliage;evergreen;;;https://www.jardiner-malin.fr/fiche/monstera-entretien.html
2; Sansevieria;indoor;brightInd;easy;medium;frostTender;low;perennial;7;15;30;60;;;;[3, 4];[3, 4, 5];;[11, 12, 1, 2];Mélangez du terreau et du sable (2/3 et 1/3).;Éliminer les feuilles sèches ou abîmées.;Arrosez modérément, attendez que la terre se dessèche avant un nouvel apport en eau.;La sansevière est une plante vivace, résistante et peu sensible aux maladies.;foliage;evergreen;;;https://www.jardiner-malin.fr/fiche/langue-de-belle-mere.html
3; Zamioculcas;indoor;partial;easy;medium;frostTender;low;perennial;7;15;30;12;;[3];;;[3, 4, 5];;[11, 12, 1, 2];Terreau pour plantes vertes (prévoir une couche de drainage au fond du pot);Couper les feuilles jaunies/sèches;Laissez sécher le substrat entre deux arrosages, ne laissez pas d'eau dans la soucoupe.;Le zamioculcas est une plante verte d'intérieur, esthétique et facile à entretenir.;foliage;evergreen;;;https://www.gerbeaud.com/jardin/fiches/zamioculcas.php
4; Pothos;indoor;partial;easy;medium;frostTender;high;perennial;7;15;0;24;;;;;[3, 4, 5];[3];[11, 12, 1, 2];Terreau plante d’intérieur;Aucune taille n’est indispensable, raccourcir les branches de moitié au printemps si nécessaire.;Arrosez uniquement lorsque la surface du sol est sèche, évitez les excès d'eau.;Le pothos est une plante d'intérieur facile à cultiver, appréciée pour son feuillage décoratif.;foliage;evergreen;;;https://www.jardiner-malin.fr/fiche/pothos-scindapsus.html
5; Chlorophytum;indoor;brightInd;easy;medium;frostTender;low;perennial;7;15;30;24;;;;;[3, 4];;[11, 12, 1, 2];terreau léger et bien drainé;Supprimez les feuilles mortes et fanées au fur et à mesure.;Maintenez le terreau légèrement humide et brumisez le feuillage.;Le chlorophytum est une plante d'intérieur appréciée pour son feuillage décoratif et sa facilité d'entretien.;foliage;evergreen;;;https://www.jardiner-malin.fr/fiche/chlorophytum.html
6; Crassula;indoor;partial;easy;low;frostTender;none;perennial;15;30;0;24;;;;[6];[3, 4, 5];[6];[11, 12, 1, 2];Terreau léger, bien drainé;Couper les branches vieillissantes ou faibles, éviter de tailler plus d'un tiers.;Arroser uniquement lorsque le sol est bien sec, privilégier un bon arrosage.;Plante succulente originaire d'Afrique du Sud, facile à cultiver et peu exigeante.;foliage;evergreen;;;https://www.jardiner-malin.fr/fiche/crassula.html
7; Aloe Vera;indoor;brightInd;easy;low;frostTender;low;perennial;7;21;0;24;;;;[3];[3];;[11, 12, 1, 2];Terreau + sable (très drainant);Couper les feuilles jaunies/sèches.;Arroser quand la surface est sèche, éviter l'excès d'eau.;Plante d'intérieur décorative, facile d'entretien et frugale en eau.;foliage;evergreen;;;https://www.jardiner-malin.fr/fiche/aloe-vera.html
8; Ficus Elastica;indoor;brightInd;medium;high;frostTender;high;perennial;7;15;30;0;;;;;[3, 4, 5];[2, 8];[11, 12, 1, 2];terreau pour plantes vertes, léger et drainant;Aucune taille n’est indispensable, mais vous pouvez tailler 1 à 2 fois par an pour maîtriser sa hauteur.;Arrosez lorsque la terre est sèche en surface, sans excès.;Le ficus elastica est une plante d’intérieur appréciée pour son feuillage épais et brillant, originaire d’Asie du Sud-Est.;foliage;evergreen;;;https://www.jardiner-malin.fr/fiche/caoutchouc-ficus-elastica.html
9; Ficus Benjamina;indoor;brightInd;medium;high;frostTender;low;perennial;7;15;30;24;;;;;[3, 4, 5];[3, 4, 5];[11, 12, 1, 2];Terreau pour plantes vertes ou plantes d'intérieur, léger et drainant.;Pincez pour densifier, supprimez les feuilles/tiges sèches.;Maintenez une humidité élevée et un arrosage approprié.;Le Ficus benjamina est une plante d'intérieur populaire, appréciée pour son feuillage décoratif.;foliage;evergreen;;;https://www.jardiner-malin.fr/fiche/ficus-benjamina.html
10; Ficus Lyrata;indoor;brightInd;medium;high;frostTender;high;perennial;7;15;30;24;;;;;[3, 4, 5];[2, 8];[11, 12, 1, 2];Terreau pour plantes vertes d’intérieur bien drainant (avec un peu de perlite ou de billes d’argile);Couper les feuilles jaunies/sèches et tailler légèrement les extrémités pour favoriser la ramification.;Arrosez lorsque la terre est sèche en surface, en évitant l'excès d'eau stagnante.;Le ficus lyrata est une plante d’intérieur appréciée pour son feuillage vert, coriace et brillant, et il a besoin d'humidité ambiante.;foliage;evergreen;;;https://www.jardiner-malin.fr/fiche/ficus-lyrata-figuier-lyre.html
11; Dracaena Marginata;indoor;brightInd;easy;medium;frostTender;low;perennial;5;15;15;24;;;;;[3, 4, 5];[3];[11, 12, 1, 2];Terreau drainant;Couper les feuilles jaunies/sèches.;Arrosez quand la surface est sèche sur 2–3 cm.;Plante d’intérieur graphique et robuste, le dragonnier s’adapte très bien aux logements contemporains.;foliage;evergreen;;;https://www.jardiner-malin.fr/fiche/dracaena-entretien-maladies-rempotage.html
12; Yucca;indoor;brightInd;easy;medium;frostTender;high;perennial;7;21;30;24;;;;;[3, 4, 5];[3, 4];[11, 12, 1, 2];mélange drainant (terreau plantes vertes + sable/billes d’argile);Coupez idéalement juste au-dessus d’un départ de feuilles.;Laissez sécher la surface du terreau entre deux apports.;Le yucca est une plante appréciée pour son allure exotique et sa facilité d’entretien.;foliage;evergreen;;;https://www.jardiner-malin.fr/fiche/yucca-entretien.html
13; Schefflera;indoor;brightInd;easy;medium;frostTender;low;perennial;7;15;0;24;;;;;[3, 4, 5];[3, 4];[11, 12, 1, 2];Terreau Plantes d’intérieur;Pincer la tige principale pour favoriser la ramification.;Arrosez lorsque la terre est sèche, évitez les arrosages abondants.;Le Schefflera est apprécié pour son feuillage et sa robustesse, s'adaptant bien aux intérieurs.;foliage;evergreen;;;https://www.jardiner-malin.fr/fiche/schefflera.html
14; Spathiphyllum;indoor;partial;easy;high;frostTender;low;perennial;7;15;14;24;;;;[4, 5, 6, 7];[3, 4, 5];[1, 2, 3, 4, 5, 6, 7, 8, 9, 10, 11, 12];[11, 12, 1, 2];Terreau riche et drainant;Couper les spathes fanées à la base.;Maintenez une bonne hygrométrie et arrosez régulièrement.;Plante d'intérieur appréciée pour son feuillage élégant et sa floraison graphique.;flowering;evergreen;;;https://www.jardiner-malin.fr/fiche/spathiphyllum-entretien-arrosage.html
15; Anthurium;indoor;brightInd;medium;high;frostTender;low;perennial;7;15;15;24;;;;[6, 7, 8];[3];;[11, 12, 1, 2];substrat légèrement humide, drainant;Supprimez les fleurs fanées au fur et à mesure.;Vaporisez régulièrement de l'eau sur les feuilles pour recréer une atmosphère humide.;L'anthurium est une plante épiphyte qui nécessite une humidité élevée et une lumière vive sans soleil direct.;flowering;evergreen;;;https://www.jardiner-malin.fr/fiche/anthurium.html
16; Calathea;indoor;brightInd;medium;high;frostTender;none;perennial;7;15;30;24;;;;;[3];;[11, 12, 1, 2];Terreau léger et drainant;Ôtez les feuilles sèches;Arrosage régulier mais mesuré, brumisation régulière;Plante décorative au feuillage graphique, sensible à l'air sec;foliage;evergreen;;;https://www.jardiner-malin.fr/fiche/calathea-entretien-arrosage-maladie.html
17; Alocasia;indoor;partial;medium;high;frostTender;high;perennial;3;10;15;0;;[3];;[6, 7, 8, 9];[3, 4, 5];;[11, 12, 1, 2];Mélange riche mais très aéré, terreau pour plantes vertes de qualité, fibre de coco, perlite ou sable grossier.;Couper les feuilles abîmées à la base.;Brumisez régulièrement le feuillage et maintenez une atmosphère humide.;L'alocasia est une plante tropicale décorative, sensible à l'air sec et au froid.;foliage;evergreen;;;https://www.jardiner-malin.fr/fiche/alocasia.html
18; Pilea Peperomioides;indoor;brightInd;easy;medium;frostTender;none;perennial;7;15;0;12;;;;;[3];;[11, 12, 1, 2];substrat léger et drainant;Couper les feuilles jaunies/sèches.;Les arrosages sont réguliers mais l'eau ne doit pas stagner.;Pilea peperomioides est une plante grasse d'appartement originale, facile à cultiver et à multiplier.;foliage;evergreen;;;https://www.gerbeaud.com/jardin/fiches/pilea-peperomioides,1884.html
19; Maranta;indoor;brightInd;easy;high;frostTender;low;perennial;7;15;30;12;;;;;[3, 4, 5];;[11, 12, 1, 2];terreau pour plantes vertes;Couper les feuilles jaunies/sèches.;Facile à entretenir, idéal pour purifier l'air.;Maranta est une plante d'intérieur appréciée pour son feuillage décoratif.;foliage;evergreen;;;https://www.jardiner-malin.fr/fiche/plantes-interieur/plante-verte
20; Begonia Maculata;indoor;brightInd;easy;medium;frostTender;high;perennial;5;10;30;24;;;;[5, 6, 7, 8, 9, 10];[3];;[11, 12, 1, 2];Plante fleuries ou mélange de feuilles et de terreau;Supprimez les fleurs fanées et taillez régulièrement pour une belle forme compacte.;Arrosez lorsque la terre est sèche en surface, maintenez légèrement humide.;Le Tamaya est une forme cultivée de Begonia maculata, avec un feuillage spectaculaire et une floraison généreuse.;flowering;evergreen;;;https://www.jardiner-malin.fr/fiche/begonia-maculata-tamaya.html
21; Strelitzia reginae;indoor;partial;medium;medium;frostTender;high;perennial;7;15;30;24;;[3];;[5, 6, 7, 8, 9];[3, 4, 5];;[11, 12, 1, 2];Terreau pour plantes fleuries, bien drainé.;Supprimer les feuilles sèches au fur et à mesure.;Arroser régulièrement, surtout en été, et réduire l'arrosage en hiver.;Plante vivace originaire d'Afrique du Sud, connue pour ses grandes fleurs colorées en forme d'oiseau exotique.;flowering;evergreen;;;https://www.jardiner-malin.fr/fiche/strelitzia.html
22; Orchidée;indoor;partial;easy;high;frostTender;low;perennial;3;15;14;24;;;;[1, 2, 3, 4, 5, 6, 7, 8, 9, 10, 11, 12];[3, 4, 5];[1, 2, 3, 4, 5, 6, 7, 8, 9, 10, 11, 12];[11, 12, 1, 2];Mélange spécial très drainant (écorces, un peu de tourbe, matières aérées);Coupez la tige défleurie à mi-hauteur, juste au-dessus d'un œil.;Arrosez régulièrement mais sans excès, brumisez le feuillage.;L’orchidée phalaenopsis est une jolie fleur d’intérieur avec de longues floraisons possibles toute l’année.;flowering;evergreen;;;https://www.jardiner-malin.fr/fiche/orchidee-phalaenopsis.html
23; Kalanchoe;indoor;brightInd;easy;medium;frostTender;high;perennial;15;30;30;12;;;;[2, 3, 4];[9, 10];;[11, 12, 1, 2];Terreau léger, bien drainé;Pincer légèrement les extrémités des tiges après la floraison;Laisser sécher le substrat entre deux apports d'eau;Le kalanchoé est une plante grasse d'intérieur, facile et colorée, très florifère.;flowering;evergreen;;;https://www.jardiner-malin.fr/fiche/kalanchoe-kalankoe.html
24; Cyclamen;indoor;partial;medium;medium;frostTender;low;perennial;5;15;7;24;[8, 9];[9, 10];;[11, 12, 1, 2, 3];[3, 4, 5];;[11, 12, 1, 2];mélange léger et bien drainé;Ôtez régulièrement fleurs et feuilles fanées.;Arrosez régulièrement mais avec parcimonie pour conserver une motte légèrement humide.;Le cyclamen est une plante d'intérieur qui fleurit de novembre à mars et apprécie la fraîcheur.;flowering;deciduous;;;https://www.jardiner-malin.fr/fiche/cyclamen-arrosage-entretien.html
25; Azalée;indoor;partial;medium;high;frostTender;none;perennial;7;15;30;24;;;;[9, 10, 11, 12, 1, 2, 3, 4, 5];[3, 4, 5];[3];[11, 12, 1, 2];Terre de bruyère ou substrat acide, bien drainé.;Supprimez les fleurs fanées et taillez légèrement après la floraison.;Arrosez dès que la surface du substrat commence à sécher, sans laisser la motte se dessécher complètement.;L’azalée d’intérieur est un rhododendron à petites fleurs, sensible à l'humidité et à la chaleur sèche.;flowering;evergreen;;;https://www.jardiner-malin.fr/fiche/entretien-azalee.html
26; Echeveria;indoor;brightInd;easy;low;frostTender;none;perennial;15;30;30;12;;;;[6, 7, 8];[3, 4, 5];[1, 2, 3];[11, 12, 1, 2];Terreau pour cactées, léger et bien drainé.;Retirez les feuilles sèches à la base et supprimez les fleurs fanées.;Arrosez uniquement lorsque le sol est sec, surtout en hiver.;L'Echeveria est une succulente résistante à la sécheresse, idéale pour les intérieurs lumineux.;flowering;evergreen;;;https://www.jardiner-malin.fr/fiche/echeveria.html
27; Haworthia;indoor;brightInd;easy;medium;frostTender;none;perennial;21;30;0;0;;;;;[3, 4, 5];;[11, 12, 1, 2];Terreau drainant;Couper les feuilles jaunies/sèches.;Arroser toutes les 2 à 3 semaines.;Le Haworthia est une plante grasse qui se plaît dans des conditions lumineuses et nécessite peu d'entretien.;foliage;evergreen;;;https://www.jardiner-malin.fr/fiche/plantes-bureau-bienfaits-varietes.html
28; Cactus de Noël;indoor;brightInd;easy;medium;frostTender;none;perennial;7;15;15;24;;;;[12];[3];[1];[11, 12, 1, 2];Utiliser un terreau léger comme ceux préconisés pour les plantes cactées.;Pincer les tiges après la floraison pour garder un port compact.;Laisser sécher le terreau entre 2 arrosages et éviter l'eau stagnante.;Le cactus de Noël fleurit entre novembre et janvier et nécessite des nuits longues pour initier ses boutons.;flowering;evergreen;;;https://www.jardiner-malin.fr/fiche/schlumbergera.html
29; Sedum;outdoor;direct;easy;low;hardy;none;perennial;20;45;30;0;;;;[5, 6, 7];[3, 4, 5];;[11, 12, 1, 2];Mélange de sol commercial pour succulentes ou cactus, bien drainé.;Couper les feuilles jaunies/sèches.;Arroser modérément, surtout en période de sécheresse.;Sedum spurium est une plante vivace résistante à la sécheresse, idéale comme couvre-sol.;foliage;semi_evergreen;;;https://www.jardiner-malin.fr/fiche/sedum-spurium-orpin-batard.html
30; Kentia;indoor;partial;easy;medium;frostTender;none;perennial;7;10;30;24;;;;;[3, 4, 5];[1, 2, 3, 4, 5, 6, 7, 8, 9, 10, 11, 12];[11, 12, 1, 2];terreau de qualité pour plantes d’intérieur, drainant;Retirez les feuilles jaunes ou très abîmées.;Arrosages réguliers mais sans excès, humidité ambiante.;Le Kentia est un palmier d’intérieur robuste, adapté à des conditions de vie modérées.;foliage;evergreen;;;https://www.jardiner-malin.fr/fiche/howea.html
31; Pachira;indoor;brightInd;easy;medium;frostTender;none;perennial;7;21;30;24;;;;;[3, 4, 5];[3];[11, 12, 1, 2];terreau riche & drainant;Pincez les extrémités au printemps pour un port compact.;Arrosez quand les 2–3 cm supérieurs sont secs, ne laissez jamais d'eau stagnante.;Le pachira est une plante d'intérieur facile, graphique et dépolluante.;foliage;evergreen;;;https://www.jardiner-malin.fr/fiche/pachira.html
32; Fittonia;indoor;partial;easy;high;frostTender;none;perennial;7;15;15;24;;;;;[3, 4, 5];[3, 4, 5];[11, 12, 1, 2];terreau riche, léger, drainant;Pincez régulièrement l’extrémité des tiges pour garder une plante compacte.;Arrosez régulièrement, mais modérément, en maintenant le terreau légèrement humide.;Le fittonia est une plante d'intérieur tropicale appréciée pour son feuillage décoratif et sa capacité à s'adapter à des conditions de lumière tamisée.;foliage;evergreen;;;https://www.jardiner-malin.fr/fiche/fittonia.html
33; Coffea arabica;indoor;partial;medium;medium;frostTender;high;perennial;7;15;30;24;;;[6, 7, 8, 9, 10, 11, 12];[6, 7];[3];;[11, 12, 1, 2];Mélange 1/3 terreau plantes vertes + 2/3 terre de bruyère, complété de vermiculite ou perlite.;Pincez les jeunes tiges pour ramifier et limiter la hauteur.;Gardez le substrat légèrement humide, évitez l'air trop sec.;Coffea arabica est un arbuste ornemental d'intérieur, originaire d'Afrique de l'Est, qui peut produire des cerises contenant des grains de café.;flowering;evergreen;;;https://www.jardiner-malin.fr/fiche/cafeier.html
34; Poinsettia;indoor;;medium;;frostTender;low;;7;15;30;0;;;;;[3, 4, 5];;[11, 12, 1, 2];Terreau pour plantes d'intérieur;Couper les feuilles jaunies/sèches.;Arroser modérément et éviter l'excès d'eau.;Le Poinsettia, aussi connu sous le nom d'étoile de Noël, est une plante d'intérieur populaire pendant les fêtes.;flowering;;;;https://www.jardiner-malin.fr/fiche/plantes-interieur/page/2
35; Peperomia Obtusifolia;indoor;brightInd;easy;medium;frostTender;low;perennial;7;15;30;12;;;;;[3, 4, 5];;[11, 12, 1, 2];terreau pour plantes vertes;Couper les feuilles jaunies/sèches.;Arroser modérément, laisser sécher entre les arrosages.;Peperomia obtusifolia est une plante d'intérieur appréciée pour son feuillage décoratif.;foliage;evergreen;;;https://www.gerbeaud.com/diaporamas/plantes-vertes-interieur-stars-2021,661,7.html
36; Beaucarnea;indoor;brightInd;easy;low;frostTender;none;perennial;30;0;30;36;;;;;[3];[1, 2];[11, 12, 1, 2];Terreau spécial plante d'intérieur, bien drainant.;Couper les feuilles trop longues en diagonale.;Arrosage rare, laisser sécher complètement entre deux apports d'eau.;Le beaucarnea est une plante graphique et très résistante, originaire du Mexique.;foliage;evergreen;;;https://www.jardiner-malin.fr/fiche/beaucarnea.html
37; Fougère de Boston;indoor;partial;easy;high;frostTender;none;perennial;5;15;30;24;;;;;[3, 4, 5];[3, 4, 5];[11, 12, 1, 2];Terreau spécial plantes vertes;Couper les feuilles jaunies ou sèches au fur et à mesure.;Brumiser régulièrement le feuillage et arroser lorsque la terre est sèche au toucher.;La fougère de Boston est une plante tropicale appréciée pour son feuillage décoratif et son rôle dépolluant.;foliage;evergreen;;;https://www.jardiner-malin.fr/fiche/fougere-de-boston.html
38; Areca;indoor;brightInd;easy;medium;frostTender;none;perennial;7;15;15;24;;;;;[3, 4, 5];[1, 2, 3, 4, 5, 6, 7, 8, 9, 10, 11, 12];[11, 12, 1, 2];Terreau riche et drainant;Coupez à la base les palmes entièrement sèches.;Brumisez finement le feuillage et arrosez régulièrement en laissant sécher 2-3 cm en surface.;L'Areca est un palmier d'intérieur facile, exotique et design, apprécié pour son élégance.;foliage;evergreen;;;https://www.jardiner-malin.fr/fiche/areca-entretien-arrosage-rempotage.html
39; Chaîne de cœurs;indoor;brightInd;easy;low;frostTender;none;perennial;10;20;30;0;;;;[8];[3, 4, 5];;[11, 12, 1, 2];Mélange de bon terreau du commerce et de sable de rivière ou de perlite.;Couper les feuilles jaunies/sèches.;Arrosez très parcimonieusement, un arrosage tous les 10 jours en période de croissance.;Ceropegia woodii est une plante vivace originaire d'Afrique du Sud, appréciée pour son feuillage léger et sa forme graphique.;foliage;evergreen;;;https://www.gerbeaud.com/jardin/fiches/ceropegia-culture,1600.html
40; Misère;outdoor;partial;easy;medium;hardy;none;perennial;5;15;30;0;;[9, 10, 11];;[6, 7, 8, 9, 10];[3, 4, 5];[10];[11, 12, 1, 2];Ordinaire à riche, frais, bien drainé;Rabattez la touffe à ras lorsque le feuillage jaunit totalement.;Paillez pour conserver la fraîcheur du sol. Arrosez uniquement en cas de sécheresse prolongée.;Plante vivace herbacée appréciée pour sa floraison estivale généreuse et sa rusticité.;flowering;deciduous;;;https://www.jardiner-malin.fr/fiche/ephemere-de-virginie.html
41; Dieffenbachia;indoor;brightInd;medium;high;frostTender;high;perennial;7;15;15;24;;;;;[3, 4, 5];[1, 2, 3, 4, 5, 6, 7, 8, 9, 10, 11, 12];[11, 12, 1, 2];Terreau pour plantes vertes, léger et drainant;Supprimez les feuilles jaunes, sèches ou abîmées à la base.;Maintenez une bonne hygrométrie et retirez les feuilles abîmées.;Le dieffenbachia est une plante d’intérieur très appréciée pour son feuillage spectaculaire.;foliage;evergreen;;;https://www.jardiner-malin.fr/fiche/dieffenbachia-entretien-arrosage.html
42; Croton;indoor;brightInd;medium;high;frostTender;low;perennial;7;15;15;24;;;;;[3, 4, 5];[3];[11, 12, 1, 2];Terreau riche et drainant;Tailler légèrement les tiges dénudées pour favoriser la ramification.;Maintenez le terreau humide mais jamais détrempé.;Le croton est une plante d'intérieur tropicale avec un feuillage éclatant et coloré.;foliage;evergreen;;;https://www.jardiner-malin.fr/fiche/croton-entretien-arrosage.html
43; Tomate;vegetable;direct;easy;medium;frostTender;none;annual;3;15;30;0;[2, 3];[5];[6, 7, 8, 9];;[3, 4, 5];[6, 7];[11, 12, 1, 2];Léger, assez riche;Supprimez les gourmands et taillez la tête en laissant 4 ou 5 groupes de feuilles.;Arrosage régulier sans mouiller le feuillage.;La tomate est un légume-fruit très cultivé, riche en vitamines et minéraux.;fruit;deciduous;;fruit;https://www.jardiner-malin.fr/fiche/culture-tomate.html
44; Courgette;vegetable;direct;easy;medium;frostTender;none;annual;4;0;30;0;[3, 4];[4, 5];[6, 7, 8];;[3, 4, 5];[6, 7, 8];[11, 12, 1, 2];Plutôt léger et bien drainé;Retirer uniquement les feuilles abîmées ou malades.;Arroser régulièrement, surtout au début, pour favoriser l’enracinement.;La courgette est un légume/fruit incontournable du potager, apprécié pour sa culture facile et sa généreuse production tout l’été.;fruit;deciduous;;fruit;https://www.jardiner-malin.fr/fiche/courgette.html
45; Aubergine;vegetable;brightInd;medium;medium;frostTender;none;annual;3;15;15;0;[2, 3];[5, 6];[7, 8];;[3, 4, 5];[6, 7, 8];[11, 12, 1, 2];Terreau riche et bien drainé.;Supprimez les gourmands et coupez la tige principale au-dessus de la deuxième fleur.;Arrosez régulièrement, surtout en période de chaleur, et fertilisez tous les 15 jours.;L'aubergine est un légume-fruit apprécié pour sa saveur et sa polyvalence en cuisine.;fruit;deciduous;;fruit;https://www.jardiner-malin.fr/fiche/aubergine-entretien.html
46; Poivron;vegetable;direct;medium;medium;frostTender;none;annual;3;15;14;0;[2];[5];[7, 8, 9];;[3, 4, 5];;;Terreau pour légumes, bien drainant.;Couper les feuilles jaunies/sèches.;Veiller à l'arrosage régulier, sans excès d'humidité.;Le poivron est une plante potagère gourmande, riche en vitamine C.;fruit;deciduous;;fruit;https://www.jardiner-malin.fr/fiche/poivron-en-pot.html
47; Piment;vegetable;direct;easy;medium;frostTender;none;annual;3;10;15;0;[1, 2];[5];[8, 9];[6, 7];[3, 4, 5];;[11, 12, 1, 2];Terreau premium pour plantes potagères, bien drainant.;Couper les feuilles jaunies/sèches.;Arrosages fréquents mais modérés, maintenir le substrat frais.;Le piment est un légume condimentaire qui s’adapte bien à la culture en pot.;fruit;deciduous;;fruit;https://www.jardiner-malin.fr/fiche/piment-en-pot.html
48; Concombre;vegetable;direct;easy;medium;frostTender;none;annual;3;0;30;0;[3, 4];[5, 6];[5, 6, 7, 8, 9, 10];;[3, 4, 5];;;Ordinaire mais bien drainé;Pincer au-dessus de la deuxième feuille et tailler les gourmands.;Arrosez régulièrement au pied, sans mouiller les feuilles.;Le concombre est un légume-fruit de la famille des cucurbitacées, facile à cultiver et apprécié pour sa chair croquante.;fruit;deciduous;;fruit;https://www.jardiner-malin.fr/fiche/culture-concombre.html
49; Fraisier;vegetable;partial;easy;medium;hardy;none;perennial;3;15;30;0;[3, 4];[3, 9, 10];[4, 5, 6, 7, 8, 9, 10];[4, 5];[3, 4, 5];[3, 4];[11, 12, 1, 2];sol riche, frais et bien drainé;Supprimez les stolons au fur et à mesure.;Arrosez régulièrement, surtout en période de floraison et de fructification.;Le fraisier est une plante vivace herbacée cultivée pour ses fruits sucrés et parfumés.;fruit;deciduous;;fruit;https://www.jardiner-malin.fr/fiche/fraisier.html
50; Framboisier;vegetable;brightInd;easy;medium;hardy;none;biennial;10;20;30;0;[3, 4];[9, 10];[6, 7, 9, 10];[4, 5];[3, 4, 5];[8, 2];[11, 12, 1, 2];Sol frais, léger, riche en humus et drainé.;Supprimer les drageons en surnombre et rabattre les tiges ayant produit des fruits.;Arroser régulièrement et pailler pour maintenir un sol frais.;Le framboisier est un arbuste fruitier qui produit des framboises délicieuses et est facile à cultiver.;fruit;deciduous;;fruit;https://www.jardiner-malin.fr/fiche/framboisier.html
51; Carotte;vegetable;partial;easy;medium;hardy;none;biennial;4;0;30;0;[2, 3, 4, 5, 6, 7];[4, 5];[6, 7, 8, 9, 10, 11, 12];;[3, 4, 5];;[11, 12, 1, 2];Léger, meuble, sableux, profond, sans cailloux;Éclaircir les carottes pour laisser de l'espace aux plus beaux sujets.;Arroser modérément mais régulièrement en période sèche.;La carotte est un légume-racine incontournable du potager, facile à cultiver et assure des récoltes généreuses.;foliage;deciduous;;root;https://www.jardiner-malin.fr/fiche/carotte.html
52; Radis;vegetable;brightInd;easy;medium;hardy;none;annual;4;0;30;0;[2, 3, 4, 5, 6, 7, 8, 9];[3, 4, 5, 6, 7, 8, 9];[3, 4, 5, 6, 7, 8];;[3, 4, 5];;;Terreau léger et bien drainant.;Couper les feuilles jaunies.;Arroser régulièrement pour garder le sol humide.;Le radis est une culture rapide et facile, idéale pour les potagers.;fruit;deciduous;;root;https://www.gerbeaud.com/jardin/fiches/radis-meilleures-varietes-printemps-ete,1367.html
53; Pomme de terre;vegetable;direct;easy;medium;hardy;none;annual;4;15;30;0;[3, 4];[3, 4];[6, 7, 9, 10];;[3, 4, 5];;[11, 12, 1, 2];Terre légère, riche et peu humide.;Conservez 2-3 germes trapus par tubercule, retirez les autres.;Arrosez modérément et ajustez en fonction des conditions climatiques.;La pomme de terre est facile à cultiver, productive et polyvalente en cuisine.;fruit;deciduous;;root;https://www.jardiner-malin.fr/fiche/pomme-de-terre.html
